{
  "schema": "afb.alarm.v1",
  "id": "alarm-touch-0001",
  "ticker": "SBER",
  "condition": {
    "left": {"source": "price", "field": "last"},
    "right": {"const": "250.5"}
  },
  "period": "10min",
  "trigger_frequency": "once",
  "status": "active",
  "created_at": "2026-06-26T12:00:00+03:00",
  "updated_at": "2026-06-26T12:00:00+03:00",
  "triggered_at": "",
  "delivery_at": "",
  "trigger_count": 0
}
