{
  "schema": "afb.alarm.v1",
  "id": "alarm-indicator-crossing-0001",
  "ticker": "SBER",
  "condition": {
    "op": "crosses_above",
    "left": {"source": "indicator", "id": "wma20"},
    "right": {"source": "indicator", "id": "kama10"}
  },
  "period": "15min",
  "trigger_frequency": "every_candle",
  "status": "active",
  "created_at": "2026-06-26T12:00:00+03:00",
  "updated_at": "2026-06-26T12:00:00+03:00",
  "triggered_at": "",
  "delivery_at": "",
  "trigger_count": 0
}
