{
  "schema": "afb.alarm.v1",
  "id": "alarm-dataset-position-0001",
  "ticker": "SBER",
  "condition": {
    "op": "above",
    "left": {"source": "dataset", "dataset_id": "positions", "field": "long"},
    "right": {"const": "1000"}
  },
  "period": "10min",
  "trigger_frequency": "daily",
  "status": "active",
  "created_at": "2026-06-26T12:00:00+03:00",
  "updated_at": "2026-06-26T12:00:00+03:00",
  "triggered_at": "",
  "delivery_at": "",
  "trigger_count": 0
}
