{
  "schema": "afb.alarm.v1",
  "id": "alarm-breakout-0001",
  "ticker": "GDU6",
  "condition": {
    "op": "breakout",
    "left": {"source": "price", "field": "last"},
    "right": {"const": "4300.0"},
    "timeframe": "1h"
  },
  "period": "1h",
  "trigger_frequency": "every_candle",
  "status": "active",
  "created_at": "2026-06-26T12:00:00+03:00",
  "updated_at": "2026-06-26T12:00:00+03:00",
  "triggered_at": "",
  "delivery_at": "",
  "trigger_count": 0
}
